{
  "$schema": "http://json-schema.org/draft-07/schema#",
  "$id": "level-design-deck/schema/storyboard.schema.json",
  "title": "storyboard spec",
  "description": "关卡分镜 (storyboard) — bubble_diagram 关键 beat 的画面层投影。产出物 = img2img 文字提示词 (generated_prompt)。style_anchor 全局共享保证风格一致；panels[] 每帧只变内容字段。预留 ImageProvider API 接口。M4.1 v0.1.0 M5.4 v0.2.0: meta 加 optional phase 字段 (L0/whitebox/docified)。v0.3.0: 新增 source_materials (剧本/大纲导入) + ld_notes (LD 调整建议)。",
  "version": "0.3.0",
  "applies_to": [
    "POI",
    "gameplay",
    "mixed"
  ],
  "type": "object",
  "required": [
    "meta",
    "context",
    "style_anchor",
    "panels"
  ],
  "additionalProperties": false,
  "properties": {
    "meta": {
      "title": "元信息",
      "type": "object",
      "required": [
        "spec_id",
        "level_id",
        "version"
      ],
      "additionalProperties": false,
      "properties": {
        "spec_id": {
          "title": "Spec ID",
          "type": "string",
          "pattern": "^storyboard_[a-z0-9_]+$",
          "description": "spec 唯一 ID，命名规则 storyboard_<level_short_name>"
        },
        "level_id": {
          "title": "关卡 ID",
          "type": "string",
          "minLength": 1
        },
        "version": {
          "title": "版本号",
          "type": "string",
          "pattern": "^\\d+\\.\\d+\\.\\d+$"
        },
        "owner": {
          "title": "责任方",
          "type": "string",
          "default": "level"
        },
        "phase": {
          "title": "阶段",
          "type": "string",
          "enum": [
            "L0",
            "whitebox",
            "docified"
          ],
          "description": "该 module 在 5 阶段流程中的归属 (L0=设计意图期 / whitebox=白盒可玩期 / docified=文档化分发期)。M5.4 加入；optional，旧 spec 可不填。详见 PROJECT.md 决议 F + lib/protocol/README。"
        }
      }
    },
    "context": {
      "title": "上下文",
      "type": "object",
      "required": [
        "intent",
        "level_type"
      ],
      "additionalProperties": false,
      "properties": {
        "intent": {
          "title": "设计意图",
          "type": "string",
          "minLength": 10
        },
        "level_type": {
          "title": "关卡类型",
          "type": "string",
          "enum": [
            "poi",
            "gameplay",
            "mixed"
          ]
        }
      }
    },
    "style_anchor": {
      "title": "风格锚定（全局共享）",
      "type": "object",
      "description": "决定整套 panels 的 img2img 风格一致性。改一处此处字段，所有 panel 拼接出的 prompt 自动同步更新。",
      "required": [
        "medium",
        "art_direction",
        "color_palette",
        "lighting_aesthetic",
        "negative_prompt"
      ],
      "additionalProperties": false,
      "properties": {
        "medium": {
          "title": "媒介",
          "type": "string",
          "minLength": 3,
          "description": "画面媒介，如 cinematic concept art / Japanese anime imageboard / ink wash"
        },
        "art_direction": {
          "title": "艺术方向",
          "type": "string",
          "minLength": 3,
          "description": "画风总纲，如 loose pencil sketch with ink line emphasis, cross-hatching shadow"
        },
        "color_palette": {
          "title": "色板",
          "type": "string",
          "minLength": 3,
          "description": "色彩方案，如 monochrome graphite on cream paper, no chromatic color"
        },
        "lighting_aesthetic": {
          "title": "光感美学",
          "type": "string",
          "minLength": 3,
          "description": "光感总纲，如 implied lighting through hatching density, deep black accents"
        },
        "quality_tags": {
          "title": "质量词",
          "type": "array",
          "description": "质量/技术词数组，如 [\"rough sketch\", \"pre-production concept\"]",
          "items": {
            "type": "string",
            "minLength": 1
          }
        },
        "negative_prompt": {
          "title": "反向 prompt",
          "type": "string",
          "minLength": 3,
          "description": "img2img 反向提示词，如 color, painted, photorealistic, low quality, watermark"
        },
        "reference_image_url": {
          "title": "风格锚定参考图",
          "type": "string",
          "description": "img2img 默认参考图路径或 URL。panels[].source_image_url 为空时继承本字段。"
        },
        "presentation": {
          "title": "装帧（CSS 渲染用）",
          "type": "object",
          "description": "panel 装帧样式，由 template.html CSS 应用，不入 generated_prompt。",
          "additionalProperties": false,
          "properties": {
            "frame_style": {
              "title": "边框样式",
              "type": "string",
              "description": "如 thin black border / none"
            },
            "paper_texture": {
              "title": "纸张质感",
              "type": "string",
              "description": "如 aged cream paper / white"
            },
            "aspect_ratio": {
              "title": "画幅比",
              "type": "string",
              "description": "如 16:9 / 2.39:1 / 1:1"
            }
          }
        }
      }
    },
    "prompt_template": {
      "title": "Prompt 拼接模板",
      "type": "string",
      "default": "{style.medium}, {style.art_direction}, {scene}, {subject_action}, {camera}, {lighting}, {mood}, {style.color_palette}, {style.quality_tags}",
      "description": "tools/storyboard_render.py 按本模板 deterministic 拼接 generated_prompt。占位符：{style.<field>} 取自 style_anchor；{scene} {subject_action} {camera} {lighting} {mood} 取自 panel。空字段自动继承 style_anchor（如 panel.lighting 空则用 style.lighting_aesthetic）。"
    },
    "source_materials": {
      "title": "素材导入",
      "type": "object",
      "description": "剧本/大纲等参考文本，供分镜设计时查阅。不入 prompt。",
      "additionalProperties": false,
      "properties": {
        "script_text": {
          "title": "剧本文本",
          "type": "string",
          "description": "粘贴的剧本原文或摘要。自由文本。"
        },
        "story_outline": {
          "title": "故事大纲",
          "type": "string",
          "description": "故事结构/大纲参考。自由文本。"
        }
      }
    },
    "ld_notes": {
      "title": "LD 调整备注",
      "type": "object",
      "description": "分镜设计过程中产生的关卡/剧本调整建议，供跨团队讨论。导出为 markdown。",
      "additionalProperties": false,
      "properties": {
        "global_notes": {
          "title": "整体建议",
          "type": "string",
          "description": "全局性的大纲/剧本调整建议。"
        },
        "panel_notes": {
          "title": "逐帧备注",
          "type": "array",
          "items": {
            "type": "object",
            "additionalProperties": false,
            "properties": {
              "panel_id": {
                "type": "string"
              },
              "note": {
                "type": "string"
              }
            },
            "required": [
              "panel_id",
              "note"
            ]
          }
        }
      }
    },
    "panels": {
      "title": "分镜帧列表",
      "type": "array",
      "minItems": 1,
      "description": "按时间顺序排列的关键 beat 分镜帧。每帧对应 bubble_diagram 中一个节点。",
      "items": {
        "title": "分镜帧",
        "type": "object",
        "required": [
          "panel_id",
          "beat_id",
          "title",
          "scene",
          "subject_action",
          "camera",
          "mood"
        ],
        "additionalProperties": false,
        "properties": {
          "panel_id": {
            "title": "Panel ID",
            "type": "string",
            "pattern": "^p[0-9]{2,3}$",
            "description": "分镜帧内部 ID，建议 p01 / p02 / p03 顺序编号"
          },
          "beat_id": {
            "title": "Beat ID",
            "type": "string",
            "minLength": 1,
            "description": "指代同 level 的 bubble_diagram.nodes[].id。M4.1 起由 cross_check.py 校验：必须命中 bubble_diagram 节点 id。"
          },
          "title": {
            "title": "Panel 标题",
            "type": "string",
            "minLength": 2,
            "description": "中文短标题，便于设计师辨识，不入 prompt"
          },
          "scene": {
            "title": "场景描述（prompt 原料）",
            "type": "string",
            "minLength": 5,
            "description": "环境/物件描述，英文，img2img 友好。如 \"an abandoned mountain temple gate in dense mist, broken torii-style stone pillars\""
          },
          "subject_action": {
            "title": "主体+动作（prompt 原料）",
            "type": "string",
            "minLength": 5,
            "description": "画面主体与动作姿态，英文。如 \"lone protagonist standing at stone steps, hand near holstered weapon\""
          },
          "camera": {
            "title": "镜头语言（prompt 原料）",
            "type": "string",
            "minLength": 3,
            "description": "视角/景别/运镜，英文。如 \"wide shot, low angle, slow push-in\""
          },
          "lighting": {
            "title": "光线（prompt 原料，可空继承）",
            "type": "string",
            "description": "本帧光线描述。留空则拼接时继承 style_anchor.lighting_aesthetic。"
          },
          "mood": {
            "title": "情绪（prompt 原料）",
            "type": "string",
            "minLength": 3,
            "description": "情绪关键词，英文。如 \"uneasy reverence, threshold-crossing tension\""
          },
          "player_intent": {
            "title": "玩家意图（仅供人读）",
            "type": "string",
            "description": "设计师意图：玩家此时该做什么。中文。不入 prompt。"
          },
          "player_feels": {
            "title": "玩家体验（仅供人读）",
            "type": "string",
            "description": "设计师意图：玩家此时该感受什么。中文。不入 prompt。"
          },
          "gameplay_moment": {
            "title": "玩法时刻（仅供人读）",
            "type": "string",
            "description": "本帧对应的玩法类型（探索/战斗/解谜/叙事/抉择/过场）+ 关键交互。中文。不入 prompt。"
          },
          "zone_id": {
            "title": "区域 ID（可选）",
            "type": "string",
            "description": "本帧发生在 spatial_layout 的哪个 zone。可选；填了由 cross_check.py 校验必须命中 spatial_layout.shapes[].label。"
          },
          "source_image_url": {
            "title": "本帧 img2img 参考图（可空继承）",
            "type": "string",
            "description": "本帧的 img2img source image。留空则继承 style_anchor.reference_image_url。"
          },
          "generated_prompt": {
            "title": "生成的 prompt（自动回填）",
            "type": "string",
            "description": "由 tools/storyboard_render.py 按 prompt_template 拼接后回填。手填值会被覆盖，不要手改。"
          },
          "generated_image_url": {
            "title": "生成的图（API 回填）",
            "type": "string",
            "description": "未来接入 img2img API 后回填，当前留空。"
          },
          "generation_meta": {
            "title": "生成元信息（API 回填）",
            "type": "object",
            "description": "未来接入 img2img API 后回填，含 provider / model / strength / seed / timestamp 等。",
            "additionalProperties": true
          }
        }
      }
    }
  }
}
